{
	"schema-link": "https://raw.githubusercontent.com/ITxPT/schematest/main/identifiers/example-globally_unique_id_value_test.schema.json",
	"version": "2.3.0",
	"atDateTime": "2022-02-14T12:45:50Z",
	"origin": "L-Test03",
	"identifier": {
	    "idType": "EUI64",
	    "idValue": "00-00-7c-5c-f8-ef-d5-0d"
	}
}
